{
  "$schema": "https://json-schema.org/draft/2020-12/schema",
  "type": "object",
  "properties": {
    "source": {
      "type": "string",
      "enum": [
        "SIMULATOR_TRUTH",
        "INDEPENDENT_MEASUREMENT",
        "RECONSTRUCTION",
        "SYNTHETIC_FIXTURE_TRUTH"
      ]
    },
    "frame": {
      "const": "robot_base"
    },
    "units": {
      "const": "m"
    },
    "objects": {
      "type": "array",
      "items": {
        "type": "object",
        "properties": {
          "id": {
            "type": "string",
            "minLength": 1
          },
          "center_m": {
            "type": "array",
            "items": {
              "type": "number"
            },
            "minItems": 3,
            "maxItems": 3
          },
          "size_m": {
            "type": "array",
            "items": {
              "type": "number",
              "exclusiveMinimum": 0
            },
            "minItems": 3,
            "maxItems": 3
          },
          "quaternion_wxyz": {
            "type": "array",
            "items": {
              "type": "number"
            },
            "minItems": 4,
            "maxItems": 4
          }
        },
        "required": [
          "id",
          "center_m",
          "size_m",
          "quaternion_wxyz"
        ],
        "additionalProperties": false
      }
    },
    "regions": {
      "type": "array",
      "items": {
        "type": "object",
        "properties": {
          "id": {
            "type": "string",
            "minLength": 1
          },
          "center_m": {
            "type": "array",
            "items": {
              "type": "number"
            },
            "minItems": 3,
            "maxItems": 3
          },
          "size_m": {
            "type": "array",
            "items": {
              "type": "number",
              "exclusiveMinimum": 0
            },
            "minItems": 3,
            "maxItems": 3
          },
          "quaternion_wxyz": {
            "type": "array",
            "items": {
              "type": "number"
            },
            "minItems": 4,
            "maxItems": 4
          }
        },
        "required": [
          "id",
          "center_m",
          "size_m",
          "quaternion_wxyz"
        ],
        "additionalProperties": false
      }
    },
    "obstacles": {
      "type": "array",
      "items": {
        "type": "object",
        "properties": {
          "id": {
            "type": "string",
            "minLength": 1
          },
          "center_m": {
            "type": "array",
            "items": {
              "type": "number"
            },
            "minItems": 3,
            "maxItems": 3
          },
          "size_m": {
            "type": "array",
            "items": {
              "type": "number",
              "exclusiveMinimum": 0
            },
            "minItems": 3,
            "maxItems": 3
          },
          "quaternion_wxyz": {
            "type": "array",
            "items": {
              "type": "number"
            },
            "minItems": 4,
            "maxItems": 4
          }
        },
        "required": [
          "id",
          "center_m",
          "size_m",
          "quaternion_wxyz"
        ],
        "additionalProperties": false
      }
    },
    "renderings": {
      "type": "array",
      "maxItems": 0
    }
  },
  "required": [
    "source",
    "frame",
    "units",
    "objects",
    "regions",
    "obstacles",
    "renderings"
  ],
  "additionalProperties": false
}
