{
  "source": "RECONSTRUCTION",
  "frame": "robot_base",
  "units": "m",
  "objects": [
    {
      "id": "target",
      "center_m": [
        0.14500069343854205,
        -0.34500187162428675,
        0.0859513695401754
      ],
      "size_m": [
        0.12499810272804263,
        0.043007870652327806,
        0.05909692122492072
      ],
      "quaternion_wxyz": [
        0.9890857474926006,
        0,
        0,
        0.1473410469183774
      ]
    }
  ],
  "regions": [],
  "obstacles": [
    {
      "id": "observed_obstacle_000",
      "center_m": [
        0.6131926367488696,
        -0.07200321499540047,
        0.12616542056265498
      ],
      "size_m": [
        0.14349142058712291,
        0.055015993645698646,
        0.18766904546989277
      ],
      "quaternion_wxyz": [
        0.8036903822494808,
        0,
        0,
        0.5950477035328205
      ]
    },
    {
      "id": "observed_obstacle_001",
      "center_m": [
        0.4924258587071237,
        -0.03515499786380119,
        0.12607380255824543
      ],
      "size_m": [
        0.14349142058712291,
        0.19751048642608943,
        0.1878523374740489
      ],
      "quaternion_wxyz": [
        0.8036903822494808,
        0,
        0,
        0.5950477035328205
      ]
    },
    {
      "id": "observed_obstacle_002",
      "center_m": [
        0.534228592805189,
        0.10184977206385762,
        0.12664988717977405
      ],
      "size_m": [
        0.14298912368075073,
        0.19751048642608943,
        0.18670014202190777
      ],
      "quaternion_wxyz": [
        0.8036903822494808,
        0,
        0,
        0.5950477035328205
      ]
    },
    {
      "id": "observed_obstacle_003",
      "center_m": [
        0.6967980684965076,
        0.2020062054032009,
        0.12615893558041302
      ],
      "size_m": [
        0.14349117080001617,
        0.055015993645698646,
        0.1876820555619383
      ],
      "quaternion_wxyz": [
        0.8036903822494808,
        0,
        0,
        0.5950477035328205
      ]
    },
    {
      "id": "observed_obstacle_004",
      "center_m": [
        0.5760312904547618,
        0.2388544225348002,
        0.12618456016301377
      ],
      "size_m": [
        0.14349117080001617,
        0.19751048642608943,
        0.18763077243575343
      ],
      "quaternion_wxyz": [
        0.8036903822494808,
        0,
        0,
        0.5950477035328205
      ]
    }
  ],
  "renderings": []
}
